Description ,URL
Xilinx PCIe Root Port Driver Landing Page,https://xilinx-wiki.atlassian.net/wiki/spaces/A/pages/85983409/Xilinx+PCIe+Root+Port
Zynq UltraScale+ MPSoC - PS/PL PCIe Drivers - Release Notes,https://www.xilinx.com/support/answers/70702.html
Xilinx PCI Express (PS-PCIe/PL-PCIe) Drivers Debug Guide,https://www.xilinx.com/support/answers/71210.html
PetaLinux Image Generation and System Example Design with ZCU102 PS-PCIe as Root Complex and ZC706 as Endpoint, https://www.xilinx.com/support/answers/71493.html
PetaLinux Image Generation and System Example Design with ZC706 as Root Complex and KC705 as Endpoint, https://www.xilinx.com/support/answers/71494.html 
