Description ,URL
Download QDMA Driver,https://github.com/Xilinx/dma_ip_drivers
QDMA Documentation,https://xilinx.github.io/dma_ip_drivers/
Queue DMA subsystem for PCI Express (PCIe) - Release Notes and Known Issues for Vivado 2018.1 and newer tool versions,https://www.xilinx.com/support/answers/70927.html
Queue DMA subsystem for PCI Express (PCIe) [Vivado 2020.1] - v3.0 to v4.0 Migration Guide,https://www.xilinx.com/support/answers/75234.html
Queue DMA subsystem for PCI Express (PCIe) - Performance Report,https://www.xilinx.com/support/answers/71453.html
QDMA Debug File System Support, https://xilinx.github.io/dma_ip_drivers/master/QDMA/linux-kernel/html/debugfs.html
QDMA Linux Kernel Driver Usage and Debug Guide,https://support.xilinx.com/s/article/72723?language=en_US
